{
  "id": "pol_approve_send_summary",
  "run_id": "run_weekly_ops_sync_20260222",
  "action_intent_id": "act_send_weekly_summary",
  "decision": "escalate",
  "risk_tier": "R2",
  "reason_codes": [
    "external_message_requires_approval"
  ],
  "required_approvals": 1,
  "policy_trace": {
    "org_policy": "org_default_safe",
    "workspace_policy": "workspace_ops_cn",
    "agent_policy": "agent_ops_assistant",
    "run_override": "",
    "effective_source": "workspace"
  },
  "evaluated_at": "2026-02-22T12:30:05Z"
}
